scp-5469,euclid,,building euclid fire loop reviewers-spotlight scp self-repairing 
scp-547,Safe,,cognitohazard document memory-affecting mind-affecting safe scp visual 
scp-5470,neutralized,,broken-god ectoentropic extradimensional gamers-against-weed k-class-scenario media neurological neutralized online religious scp 
scp-5471,safe,,ad-astra cadaver cognitohazard extraterrestrial extremity knowledge location memory-affecting safe scp second-hytoth uncontained visual 
scp-5472,Safe Neutralized,,art-exchange biological building cognitohazard mind-affecting neutralized sapient scp sentient visual 
scp-5473,Euclid,,acoustic alive antimemetic compulsion euclid humanoid location mind-affecting religious sapient scp sentient sleep transmission uncontained 
scp-5474,Keter,,alive co-authored ectoentropic empathic exquisite-corpse2020 humanoid keter metamorphic observational oneiroi scp visual 
scp-5475,Safe,,acoustic cupid2021 knowledge location rewritable safe scp self-repairing subterranean 
scp-5476,keter,,computer keter meta scp uncontained 
scp-5477,Euclid,,alive doctor-glass euclid humanoid jam-con2020 sapient scp sentient structure subterranean 
scp-5478,euclid,,alive audio chemical city co-authored euclid factory humanoid media memetic military mind-affecting recording sapient scp sensory sentient visual 
scp-5479,keter,site-43,director-moose ethics-committee keter media on-guard-43 prize-feature recording scp vikander-kneed 
scp-548,Euclid,,alive arachnid euclid invertebrate rewrite scp 
scp-5480,safe,,adult biological building furniture grand-karcist-ion liquid plant redirect safe sarkic scp skeletal tool 
scp-5481,euclid,,arboreal biological euclid extremity plant scp 
scp-5482,keter,,auditory compulsion contagion hallucination keter liquid scp 
scp-5483,esoteric-class,,building co-authored esoteric-class geological hallucination location mind-affecting neurological scp sensory subterranean 
scp-5484,safe,site-120,acoustic co-authored extradimensional from-120s-archives inscribed religious reviewers-spotlight safe scp spacetime structure 
scp-5485,pending,,aquatic building cognitohazard document infohazard jam-con2021 memetic mind-affecting pending scp spacetime visual 
scp-5486,keter,site-43,co-authored compulsion doctor-blank extradimensional historical intangible keter on-guard-43 scp uncontained 
scp-5487,safe,,addictive foundation-made jam-con2021 medical mind-affecting safe scp unusual-incidents-unit 
scp-5488,safe,site-43,adult artifact co-authored computer electronic media meta on-guard-43 redirect safe scp virus 
scp-5489,Keter Integrated,,acoustic chaos-insurgency departmentcon2022 electronic esoteric-class gru-division-p mechanical sapient scp sentient teleportation 
scp-549,Euclid,,alive animal dr-wondertainment euclid scp ursine 
scp-5490,safe,site-65,historical mind-affecting religious safe scp 
scp-5491,Safe,,building humanoid intangible musical performance safe scp sentient 
scp-5492,esoteric-class,,adaptive alive esoteric-class foundation-made future humanoid mechanical moon ontokinetic probability sapient scp sentient temporal 
scp-5493,esoteric-class,,amorphous biological doctor-bright doctor-clef esoteric-class global-occult-coalition hive-mind memecon2021-unofficial scp self-repairing swarm thermodynamic transfiguration uncontained 
scp-5494,esoteric-class,site-43,alive animal ectoentropic esoteric-class featured feline on-guard-43 reviewers-spotlight scp 
scp-5495,neutralized,,foundation-made global-occult-coalition neutralized ontokinetic reclamation scp tool 
scp-5496,esoteric-class,site-43,container director-mcinnis doctor-blank doctor-wettle ectoentropic esoteric-class indestructible inscribed metallic on-guard-43 scp teleportation 
scp-5497,Euclid,,building document electronic euclid memory-affecting meta scp 
scp-5498,Safe,site-81,autonomous biological cupid2021 fifthist ocular safe scp telepathic 
scp-5499,safe,,appliance ectoentropic electronic gustatory jam-con2020 observational omnivorous safe scp 
scp-55,Keter,,antimemetic co-authored featured infohazard keter memory-affecting meta scp 
scp-550,Euclid,site-2498,biohazard biological cadaver chemical corrosive euclid humanoid rewrite scp sentient wooden 
scp-5500,apollyon,,5000 alive apollyon doctor-bright doctor-sinclair dr-wondertainment extradimensional global-occult-coalition herman-fuller horizon-initiative humanoid interactive k-class-scenario meta narrative ontokinetic sapient sarkic scp sentient shark-punching-center wanderers-library 
scp-5501,keter,,alagadda alchemy-department artifact asci director-diaghilev extradimensional historical k-class-scenario keter light photographic portal scp 
scp-5502,pending,area-27,appliance art-exchange electronic fifthist memetic pending religious scp 
scp-5503,Safe,,chemical container empathic medical mind-affecting safe scp 
scp-5504,safe,,building compulsion safe scp sleep temporal 
scp-5505,Pending,,5000 extradimensional hallucination pending piscine predatory sapient scp sensory sentient 
scp-5506,keter,,co-authored cognitohazard extradimensional food gustatory humanoid k-class-scenario keter liquid mind-affecting religious sapient scp sentient thermodynamic transfiguration uncontained 
scp-5507,Entos1,,concept esoteric-class meta scp 
scp-5508,euclid,,carnivorous euclid insect jam-con2020 mind-affecting predatory scp telekinetic 
scp-5509,keter,,alive animal aquatic biohazard biological co-authored contagion halyna-ieva keter memoria-adytum microscopic parasitic predatory sarkic scp sentient species 
scp-551,Safe,site-19,mind-affecting safe scp toy 
scp-5510,Safe (provisional),,appliance meta safe scp temporal 
scp-5511,keter,,ectoentropic game keter scp thermodynamic 
scp-5512,keter,site-91,biological cadaver extradimensional historical keter religious ritual scp transfiguration unusual-incidents-unit 
scp-5513,Keter,,alive cupid2021 game humanoid keter memory-affecting ontokinetic sapient scp sentient teleportation 
scp-5514,thaumiel,,canon2020 co-authored concept electromagnetic extradimensional foundation-made global-occult-coalition gravity humanoid hy-brasil k-class-scenario mechanical metallic prize-feature scp thaumiel vehicle war-on-all-fronts weapon 
scp-5515,neutralized,,alive cognitohazard humanoid jam-con2020 neutralized sapient scp sentient visual 
scp-5516,safe,site-184,ambrose-restaurant animal aquatic ethics-committee hive-mind invertebrate safe scp 
scp-5517,euclid,site-65,euclid humanoid organic plant reptilian sarkic scp 
scp-5518,Thaumiel,site-18,artifact container extradimensional foundation-made k-class-scenario ontokinetic scp stone thaumiel 
scp-5519,Neutralized/Euclid,,euclid food fungus k-class-scenario ontokinetic organic scp 
scp-552,Safe,,alive humanoid predictive safe sapient scp sensory sentient temporal 
scp-5520,archon,site-43,archon humanoid location on-guard-43 ontokinetic scp sentient 
scp-5521,Keter,,antimemetic extradimensional jam-con2020 keter scp 
scp-5522,keter,site-65,contagion exchange jam-con2020 keter online ontokinetic scp spacetime 
scp-5523,esoteric-class,,alive animal arboreal biological cadaver cervine esoteric-class jam-con2020 safe scp skeletal 
scp-5524,esoteric-class,site-43,auditory cognitohazard director-mcinnis doctor-lillihammer doctor-wettle esoteric-class memetic on-guard-43 scp 
scp-5525,Safe,,aquatic artifact city global-occult-coalition immobile pentagram safe scp third-law 
scp-5526,Keter,,historical jam-con2020 k-class-scenario keter religious ritual scp the-administrator 
scp-5527,safe,,animal aquatic cadaver cetacean cognitohazard gustatory jam-con2021 mister safe scp 
scp-5528,Keter,,auditory building cadaver cognitohazard esoteric-class extradimensional global-occult-coalition humanoid immobile intangible ontokinetic scp visual 
scp-5529,keter,site-14,cognitohazard horizon-initiative infohazard keter memetic memory-affecting religious scp third-law 
scp-553,Safe,,airborne alive crystalline insect lepidopteran rewrite safe scp 
scp-5530,Safe,,alive location ontokinetic plant safe scp species 
scp-5531,Euclid,,alive animal aquatic euclid geological jam-con2021 piscine scp 
scp-5532,safe,,city jam-con2021 location ontokinetic safe scp 
scp-5533,Euclid,,amorphous animal concept euclid scp 
scp-5534,Euclid,site-06-2,alive cognitohazard compulsion euclid humanoid sapient scp sentient 
scp-5535,euclid,site-14,alive euclid extremity hostile humanoid neurological sapient scp sentient 
scp-5536,keter,,5000 artistic cognitohazard fire global-occult-coalition historical hostile humanoid keter meta moon portal radioactive religious sapient scp sentient sleep spacetime stone structure sun visual 
scp-5537,Safe,,animal aquatic biological cadaver jam-con2021 piscine safe scp 
scp-5538,Safe,,abnormalities building cognitohazard empathic inscribed knowledge safe scp 
scp-5539,safe,,artifact inscribed k-class-scenario safe scp teleportation 
scp-554,Euclid,,cadaver cognitohazard euclid mechanical observational scp structure visual 
scp-5540,Euclid,,acoustic amorphous ectoentropic empathic euclid extremity furniture intangible memory-affecting neurological sapient scp sentient 
scp-5541,esoteric-class,,apotheosis children-of-the-night esoteric-class extradimensional future k-class-scenario loop observational ontokinetic paradox scp sensory spacetime temporal thad-xyank 
scp-5542,Euclid,,co-authored euclid food location scp transfiguration 
scp-5543,Keter,,biological cognitohazard currency document exchange keter mind-affecting scp transfiguration visual 
scp-5544,Safe,,loop probability safe scp 
scp-5545,Safe,,building cadaver co-authored concept exquisite-corpse2020 extradimensional hostile reviewers-spotlight safe scp spacetime structure subterranean 
scp-5546,safe,,biological cadaver container jam-con2021 organic safe scp 
scp-5547,safe,,aquatic jam-con2021 meteorological safe scp temporal vehicle 
scp-5548,safe,,appliance biological cadaver electrical jam-con2021 liquid safe scp 
scp-5549,Safe,,alive ethics-committee foundation-made humanoid maria-jones ontokinetic safe sapient scp the-administrator 
scp-555,Euclid,,cadaver euclid indestructible magnetic metallic scp 
scp-5550,Keter [Formerly Thaumiel],,co-authored empathic historical hostile humanoid keter mind-affecting prize-feature reanimation sapient scp uncontained 
scp-5551,euclid,,auditory cognitohazard euclid gustatory jam-con2020 knowledge olfactory sapient scp sensory sentient tactile visual 
scp-5552,safe,,document electronic extradimensional global-occult-coalition meta paradox safe scp temporal transfiguration 
scp-5553,Keter,,cognitohazard infohazard keter memory-affecting online reviewers-spotlight scp 
scp-5554,Keter,,computer featured keter online sapient scp 
scp-5555,safe,,5000 are-we-cool-yet broken-god cadaver co-authored dc-al-fine doctor-clef doctor-glass doctor-mann dr-wondertainment game global-occult-coalition herman-fuller holly-light jude-kriyot location maria-jones marshall-carter-and-dark nobody ontokinetic robert-bumaro safe scp the-administrator 
scp-5556,euclid,,alive euclid humanoid jam-con2020 sapient scp sentient thermodynamic 
scp-5557,euclid,,concept euclid immobile indestructible jam-con2020 location paradox scp 
scp-5558,Keter,,adult alive amorphous audio ectoentropic humanoid keter language meta miscommunications redirect sapient scp sentient sexual teleportation 
scp-5559,Keter,,ambrose-restaurant building chaz-ambrose decommissioning-dept ectoentropic jam-con2020 keter scp three-portlands 
scp-556,Euclid,,airborne artistic euclid scp self-replicating vehicle 
scp-5560,Safe,site-64,aiad anderson autonomous computer electronic ethics-committee media predictive safe sapient scp sentient three-portlands twisted-pines 
scp-5561,NA,,document infohazard memecon2021-unofficial mind-affecting online scp 
scp-5562,esoteric-class,,british-occult-service cube esoteric-class knowledge metallic scp structure subterranean 
scp-5563,safe,,electronic historical knowledge language media memory-affecting metallic mind-affecting safe scp telepathic 
scp-5564,euclid,site-184,alive euclid game ontokinetic sapient scp sentient 
scp-5565,keter,,alive animal global-occult-coalition keter scp subterranean transfiguration vermian 
scp-5566,Safe Euclid Keter Neutralized,,5000 auditory co-authored concept contagion fire mathematical mind-affecting neutralized scp 
scp-5567,safe,site-19,co-authored humanoid loop media observational recording safe sapient scp sentient 
scp-5568,euclid,,auditory euclid hallucination humanoid intangible sapient scp sensory sentient tactile visual 
scp-5569,keter,,cadaver keter religious scp structure subterranean 
scp-557,Euclid,,bibliothetic engraved euclid historical rewrite scp stone structure subterranean 
scp-5570,pending,,acoustic artifact building electrical humanoid intangible pending scp 
scp-5571,safe,,cognitohazard compulsion media on-guard-43 safe scp vikander-kneed visual 
scp-5572,esoteric-class,site-120,cadaver co-authored esoteric-class extradimensional from-120s-archives humanoid reanimation scp skeletal 
scp-5573,keter,,co-authored ectoentropic extradimensional keter military portal religious ritual scp 
scp-5574,euclid,,concept euclid media mind-affecting narrative parasitic scp 
scp-5575,euclid,,building euclid jam-con2020 loop scp self-repairing thermodynamic 
scp-5576,euclid,site-184,alive co-authored deepwell-catalog euclid humanoid reanimation rewrite sapient scp sentient temporal 
scp-5577,euclid,,cognitohazard euclid humanoid scp skeletal 
scp-5578,pending,,autonomous departmentcon2022 ethics-committee mechanical pending sapient scp sentient tool 
scp-5579,euclid,,alive bacteria chemical euclid extraterrestrial food iris-dark marshall-carter-and-dark parasitic scp 
scp-558,Safe,,clothing light medical safe scp visual 
scp-5580,Neutralised,,art-exchange building extradimensional fifthist ijamea light military mind-affecting neutralized reviewers-spotlight scp spacetime stone 
scp-5581,keter,,audio cognitohazard extraterrestrial hostile keter location recording scp teleportation transfiguration visual 
scp-5582,keter,site-06-2,alive animal aquatic cephalopodic jam-con2021 keter sapient scp sentient uncontained 
scp-5583,euclid,,animal automaton autonomous co-authored electronic equine euclid humanoid indestructible light on-guard-43 organic sapient scp sentient 
scp-5584,euclid,,cephalopodic euclid humanoid infohazard inscription online ontokinetic reviewers-spotlight sapient scp sentient telekinetic teleportation transfiguration 
scp-5585,Safe,,alive biological building historical hostile humanoid safe scp spacetime 
scp-5586,Keter,,cognitohazard k-class-scenario keter memetic mind-affecting ocular religious scp 
scp-5587,keter,,aquatic jam-con2021 keter media recording scp temporal uncontained 
scp-5588,Keter,,extradimensional extraterrestrial gaseous jam-con2020 keter mechanical plant scp species uncontained 
scp-5589,Pending,,alive animal ectoentropic esoteric-class ranine scp sentient 
scp-559,Euclid,,ectoentropic euclid food inscribed scp temporal transfiguration 
scp-5590,safe,,automaton humanoid safe scp sentient 
scp-5591,Safe,site-14,appliance document gamers-against-weed jam-con2020 safe scp serpents-hand sugarcomb-confectionery toy 
scp-5592,euclid,site-300,biological cadaver euclid humanoid reviewers-spotlight scp 
scp-5593,keter,site-98,alive animal aquatic cetacean jam-con2021 keter liquid sapient scp sentient 
scp-5594,safe,,city fire humanoid intangible safe sapient scp sentient subterranean 
scp-5595,safe,site-300,acoustic director-lague food mechanical metallic mobile reviewers-spotlight safe sapient scp sentient 
scp-5596,keter,site-300,alive cupid2021 electronic empathic game humanoid keter mechanical sapient scp sentient sexual teleportation 
scp-5597,keter,site-184,alive animal aquatic cetacean historical humanoid keter sapient scp sentient temporal 
scp-5598,keter,,cognitohazard concept document humanoid intangible keter language meta mind-affecting poetry scp visual 
scp-5599,Euclid,,arcadia auditory euclid game rewritable scp sensory visual 
scp-56,Euclid,,euclid humanoid metamorphic mind-affecting observational sapient scp sentient 
scp-560,Safe,,alive computer electronic safe scp 
scp-5600,keter,,5000 city keter scp temporal 
scp-5601,euclid,,alive animal avian engraved euclid knowledge metallic sapient scp sentient spacetime telekinetic 
scp-5602,Euclid Keter,,animal auditory avian keter scp 
scp-5603,Safe Pending,site-14,broken-god extradimensional furniture game indestructible mobile pending portal sarkic scp 
scp-5604,safe,site-19,dado medical memetic mind-affecting safe scp transfiguration 
scp-5605,keter,,alive animal extradimensional keter location meteorological scp uncontained ursine 
scp-5606,safe,,biological safe sarkic scp sphere timepiece 
scp-5607,safe,,addictive alive biological extraterrestrial gaseous humanoid mechanical mind-affecting neurological safe scp sentient vehicle 
scp-5608,keter,,addictive gustatory jam-con2020 keter neurological scp sensory 
scp-5609,keter,,biological extraterrestrial insect jam-con2021 keter moon satellite scp sphere 
scp-561,Euclid,,euclid scp temporal 
scp-5610,keter,,antimemetic artistic compulsion feline historical intangible keter mind-affecting reviewers-spotlight scp sensory uncontained visual 
scp-5611,Euclid,,alive animal biohazard canine euclid hostile indestructible loop reanimation scp self-repairing sentient temporal 
scp-5612,safe,site-91,alive antimemetic aquatic city historical organic safe scp subterranean visual 
scp-5613,euclid,,euclid hmfscp location mind-affecting religious scp 
scp-5614,euclid,,alive cognitohazard currency departmentcon2022 engraved euclid extradimensional game humanoid knowledge ontokinetic sapient scp sculpture sentient stone 
scp-5615,Euclid,,cupid2021 euclid game humanoid online sapient scp sentient 
scp-5616,esoteric-class,site-43,alive doctor-reynders esoteric-class humanoid loop on-guard-43 sapient scp sentient temporal 
scp-5617,keter,,acoustic alive animal auditory compulsion hallucination humanoid keter sapient scp sentient uncontained ursine visual 
scp-5618,esoteric-class,site-43,esoteric-class k-class-scenario on-guard-43 scp temporal 
scp-5619,Safe,,container cupid2021 hallucination liquid safe scp teleportation visual 
scp-562,Euclid,,euclid online scp spacetime temporal uncontained 
scp-5620,euclid,,alive animal artistic chaos-insurgency euclid mind-affecting ophidian reptilian sapient scp sentient 
scp-5621,euclid,,alchemy-department aquatic euclid liquid reviewers-spotlight scp 
scp-5622,Safe,,alive computer humanoid safe sapient scp sentient 
scp-5623,esoteric-class,,esoteric-class extraterrestrial k-class-scenario mechanical metallic sapient scp sentient teleportation vehicle 
scp-5624,Safe,,extradimensional media narrative photographic safe scp 
scp-5625,keter,site-65,biological cupid2021 keter memory-affecting scp virus 
scp-5626,euclid,,clay daevite euclid extradimensional location ontokinetic ritual scp sculpture tactile teleportation 
scp-5627,Euclid,,alive animal compulsion euclid gaseous hallucination insect lepidopteran mind-affecting parasitic scp 
scp-5628,Safe,,airborne autonomous co-authored cognitohazard compulsion document exquisite-corpse2020 foundation-made hallucination humanoid mind-affecting safe scp statue stone visual 
scp-5629,keter,site-81,animal antimemetic chemical hallucination keter mind-affecting neurological parasitic predatory scp sentient sleep species swarm vermian 
scp-563,Euclid,,animal cadaver dinosaurian euclid food location reptilian scp 
scp-5630,keter,,airborne animal avian ectoentropic hostile keter scp swarm uncontained 
scp-5631,keter,,airborne alive cadaver humanoid jam-con2021 keter ophidian scp sentient 
scp-5632,euclid,,alive ambrose-restaurant animal euclid jam-con2021 piscine scp species 
scp-5633,neutralized,,biological cadaver co-authored compulsion humanoid liquid meta neutralized sapient scp sentient subterranean temporal thermal 
scp-5634,esoteric-class,,alive esoteric-class humanoid location sapient scp sentient transfiguration 
scp-5635,euclid,,automaton computer electronic euclid humanoid manna-charitable-foundation sapient satellite scp sentient transmission 
scp-5636,keter,,are-we-cool-yet broken-god chaos-insurgency chemical cognitohazard compulsion infohazard intangible keter mind-affecting neurological online religious ritual scp uncontained virus weapon 
scp-5637,safe,,city extradimensional foundation-made k-class-scenario planet safe scp 
scp-5639,safe,,airborne alive city gaseous humanoid religious safe sapient scp sentient virus 
scp-564,Safe,,humanoid safe sapient scp sentient 
scp-5640,euclid,,alive animal aquatic euclid jam-con2021 location reviewers-spotlight sapient scp sentient 
scp-5641,Safe,,art-exchange auditory building cognitohazard daevite empathic gustatory historical infohazard religious ritual safe scarlet-king scp sleep teleportation 
scp-5642,Euclid,,autonomous building euclid food jam-con2021 sapient scp sentient 
scp-5643,euclid,,acoustic addictive alive cognitohazard euclid humanoid mind-affecting sapient scp sentient tactile 
scp-5644,archon,,animal aquatic archon meteorological reptilian sapient scp sentient 
scp-5645,safe,,biological cadaver humanoid safe scp 
scp-5646,esoteric-class,,esoteric-class extradimensional k-class-scenario location meta narrative portal scp 
scp-5647,thaumiel,site-19,concept entropic ethics-committee observational ontokinetic scp temporal thaumiel 
scp-5648,keter,site-5076-1,dental extradimensional humanoid jam-con2021 keter memetic mind-affecting ontokinetic sapient scp sentient teleportation uncontained 
scp-5649,Khonsu1,,esoteric-class extraterrestrial metallic radioactive satellite scp teleportation uncontained 
scp-565,Safe,site-77,animal aquatic autonomous cadaver carnivorous reanimation safe scp 
scp-5650,esoteric-class,,animal cadaver concept esoteric-class fifthist food gustatory mathematical ontokinetic piscine scp 
scp-5651,Skll1,,esoteric-class extraterrestrial gravity hostile humanoid planet scp structure 
scp-5652,euclid,site-184,alive animal aquatic euclid microscopic piscine scp selachian sentient shark-punching-center 
scp-5653,keter,,alive hostile humanoid keter predatory religious scp sentient subterranean 
scp-5654,Ticonderoga,,auditory esoteric-class hallucination humanoid memory-affecting musical performance sapient scp sentient telepathic uncontained visual 
scp-5655,safe,,alive container humanoid metallic ontokinetic safe sapient scp sentient 
scp-5656,Safe,,alive extraterrestrial safe scp sentient species 
scp-5657,keter,,alive empathic humanoid k-class-scenario keter prize-feature sapient scp sensory sentient telepathic 
scp-5658,keter,,ectoentropic extraterrestrial keter moon scp 
scp-5659,keter,site-120,alive cupid2021 empathic from-120s-archives hostile humanoid keter metamorphic ontokinetic religious sapient scp sentient sexual telepathic 
scp-566,Anomalous Safe,,document language rewrite safe scp 
scp-5660,euclid,,euclid geological hostile religious scp skeletal subterranean 
scp-5661,Safe,,humanoid safe sapient scp self-repairing sentient serpents-hand spacetime sphere structure subterranean 
scp-5662,euclid,,acoustic aquatic euclid geological location observational recording scp visual 
scp-5663,Euclid,,euclid jam-con2020 memetic meta ritual scp transfiguration vehicle 
scp-5664,esoteric-class,,acoustic biological building esoteric-class jam-con2021 mind-affecting sapient scp sentient uncontained 
scp-5665,Keter,,airborne alive animal bovine ectoentropic fire gaseous jam-con2020 keter scp sentient uncontained 
scp-5666,safe,,5000 loop memory-affecting metallic safe scp the-administrator vehicle visual 
scp-5667,keter,site-45,keter memory-affecting meta mind-affecting scp uncontained 
scp-5668,safe,,document media memory-affecting mind-affecting parawatch safe scp visual 
scp-5669,esoteric-class,site-18,building document ectoentropic esoteric-class glass meteorological scp 
scp-567,Euclid,,building euclid scp 
scp-5670,keter,,autonomous co-authored ectoentropic exquisite-corpse2020 historical keter mechanical mobile organic sapient scp sentient vehicle 
scp-5671,keter,site-300,adaptive addictive alive animal biohazard carnivorous chaos-insurgency gaseous hive-mind insect keter knowledge lepidopteran light liquid mind-affecting neurological olfactory scp sentient swarm uncontained 
scp-5672,esoteric-class,site-120,cadaver children-of-the-night doctor-asheworth doctor-rivera esoteric-class extradimensional from-120s-archives geological inscribed location ritual scp 
scp-5673,safe,,alive arboreal cupid2021 humanoid loop plant safe scp 
scp-5674,safe,,foundation-made predictive religious safe sarkic scp spacetime visual 
scp-5675,Safe,,cognitohazard mind-affecting neurological olfactory safe scp unusual-incidents-unit vehicle visual 
scp-5676,euclid,,alive biological ethics-committee euclid humanoid jam-con2021 parasitic religious sapient scp sentient 
scp-5677,euclid,,animal biological euclid media scp transfiguration 
scp-5678,Apollyon3,,5000 black-queen chaos-insurgency esoteric-class global-occult-coalition scp serpents-hand 
scp-5679,keter,,alive animal feline historical keter knowledge scp sentient teleportation unusual-cargo 
scp-568,Safe,,artifact safe scp spacetime transfiguration 
scp-5680,Edifice,,animal avian euclid humanoid mechanical organic scp sentient transfiguration 
scp-5681,safe,site-43,co-authored compulsion game media mind-affecting on-guard-43 recording safe scp vikander-kneed 
scp-5682,neutralized,,5000 alive extradimensional hallucination humanoid mind-affecting neutralized ontokinetic pattern-screamer religious sapient scp sensory sentient unusual-incidents-unit 
scp-5683,Keter,,adaptive animal arachnid hostile keter loop scp self-repairing 
scp-5684,Neutralized,,crystalline inscribed light loop mind-affecting neutralized scp 
