scp-252,Euclid Safe,,alive animal aquatic cephalopodic cognitohazard invertebrate mind-affecting safe scp sensory species visual 
scp-2520,Euclid,,euclid infohazard memetic mind-affecting scp 
scp-2521,keter,,humanoid infohazard keter meta sc2015 scp sentient teleportation uncontained 
scp-2522,Euclid,site-18,8-ball aiad anderson broken-god computer doctor-mann electronic euclid foundation-made hostile media mtf2016 sapient scp sentient transmission 
scp-2523,Euclid,,antimemetic building euclid event-featured exchange humanoid predictive rewrite scp 
scp-2524,Safe,,artifact event-featured fire physics safe scp shadow 
scp-2525,Euclid,,2000 artifact euclid extraterrestrial scp telepathic transmission 
scp-2526,euclid,,biological euclid fungus scp species telekinetic 
scp-2527,Safe,,computer ectoentropic game safe scp statue stone totleighsoft 
scp-2528,Safe Euclid,area-12,biological computer euclid pattern-screamer plant scp ursine 
scp-2529,Euclid,,computer electronic euclid online scp 
scp-253,Euclid,,contagion euclid hive-mind scp 
scp-2530,Safe,,acoustic animal audio biological building green-king mechanical musical safe scp 
scp-2531,Euclid,,biological euclid event-featured humanoid plant reproductive scp uncontained 
scp-2532,Keter,site-104,ectoentropic keter scp species transmission 
scp-2533,Safe,site-18,cognitohazard document mind-affecting safe scp visual 
scp-2534,Euclid,,currency euclid exchange probability scp telekinetic 
scp-2535,Safe,,biological building computer ectoentropic electronic safe scp 
scp-2536,Keter,,arboreal ectoentropic keter plant scp telepathic uncontained 
scp-2537,Euclid,,alive contagion euclid humanoid metamorphic sapient scp sentient transfiguration 
scp-2538,Safe,,ectoentropic mechanical safe scp vehicle 
scp-2539,Euclid,,cadaver euclid extradimensional portal scp structure 
scp-254,Safe,,artifact humanoid intangible memory-affecting safe sapient scp sentient wooden 
scp-2540,Euclid,site-81,euclid extradimensional plant scp 
scp-2541,Euclid,,building cognitohazard concept euclid knowledge memetic mind-affecting observational scp sexual visual 
scp-2542,Euclid,,euclid extradimensional humanoid indestructible insect knowledge metamorphic plant sapient scp sentient teleportation 
scp-2543,Safe,site-14,alive electrical extradimensional humanoid k-class-scenario safe sapient scp sentient 
scp-2544,Euclid Neutralized,,compulsion future infohazard memetic neutralized reviewers-spotlight scp transmission 
scp-2545,Safe,,amorphous container hive-mind safe scp self-replicating wooden 
scp-2546,Keter,site-184,biohazard doctor-roget genetic keter mind-affecting scp transfiguration virus 
scp-2547,Keter,,canine keter sapient scp sentient transfiguration uncontained 
scp-2548,Euclid,,euclid event-featured extraterrestrial location radioactive scp spacetime transmission uncontained 
scp-2549,Euclid,,animal carnivorous cognitohazard euclid hostile mind-affecting scp sphere uncontained visual 
scp-255,Keter,,contagion extraterrestrial keter mind-affecting neurological scp transmission uncontained 
scp-2550,Safe,,acoustic alive avian safe scp self-replicating 
scp-2551,Keter,,keter location memory-affecting mind-affecting scp sensory visual 
scp-2552,Euclid,site-14,alive euclid humanoid kindness sapient scp sentient 
scp-2553,Euclid,,euclid meta narrative sapient scp sentient sheldon-katz 
scp-2554,Keter,,alive k-class-scenario keter parasitic plant scp uncontained 
scp-2555,Safe,,autonomous biological building computer plant safe scp 
scp-2556,Safe,,airborne ethics-committee global-occult-coalition radioactive safe scp vehicle 
scp-2557,Keter,,concept corporate exchange keter meta scp uncontained 
scp-2558,Safe,,aquatic audio autonomous building loop religious safe scp the-gulf 
scp-2559,Keter,,biohazard cognitohazard keter memetic mind-affecting scp sentient virus 
scp-256,Euclid,site-65,appliance electrical euclid scp 
scp-2560,safe,,cadaver document humanoid indestructible intangible knowledge physics safe sapient scp sentient teleportation transfiguration 
scp-2561,Euclid,,animal appliance biological electronic euclid feline sapient scp sentient transmission 
scp-2562,euclid,site-14,document euclid gamers-against-weed humanoid mister scp 
scp-2563,Euclid,,euclid location reanimation scp skeletal 
scp-2564,Safe,site-81,building co-authored probability safe scp 
scp-2565,keter,,concept global-occult-coalition infohazard k-class-scenario keter meta scp 
scp-2566,Euclid,,compulsion currency euclid exchange knowledge scp 
scp-2567,Euclid,,autonomous euclid humanoid scp self-repairing 
scp-2568,Safe,,game light metallic physics radioactive safe scp sphere toy 
scp-2569,Safe,,appliance biohazard electrical safe scp teleportation 
scp-257,Euclid,,alive animal autonomous euclid extradimensional location scp 
scp-2570,Euclid,,cadaver corrosive euclid extradimensional intangible musical portal scp 
scp-2571,Euclid,,antimemetic arboreal euclid memory-affecting sapient scp sentient transfiguration 
scp-2572,Safe,,empathic hallucination safe scp sensory vehicle visual 
scp-2573,euclid,,antimemetic big-cheese-horace daevite document euclid fifthist sarkic scp 
scp-2574,Keter,,biological feline global-occult-coalition hallucination historical keter mobile scp sculpture self-repairing temporal uncontained 
scp-2575,Euclid,,euclid extraterrestrial metamorphic satellite scp sculpture transmission 
scp-2576,Euclid,area-12,animal auditory cognitohazard euclid memetic observational sapient scp sentient 
scp-2577,Euclid,,euclid gru-division-p location military online recording scp 
scp-2578,Keter,,extraterrestrial hostile keter online scp three-moons-initiative transmission vehicle 
scp-2579,Safe,,alive animal computer musical safe scp ursine 
scp-258,Safe,,addictive ectoentropic liquid mind-affecting ranine safe scp toy 
scp-2580,Euclid Safe,site-18,ectoentropic extraterrestrial safe scp toy wooden 
scp-2581,Euclid,site-19,contagion euclid featured religious scp 
scp-2582,Safe,,acoustic building hallucination safe scp sleep visual 
scp-2583,Euclid,,electromagnetic euclid humanoid scp sentient 
scp-2584,Safe,area-12,animal biological ectoentropic ophidian reproductive safe scp species 
scp-2585,Euclid,,euclid extraterrestrial geological humanoid meteorological scp 
scp-2586,Euclid,site-14,alive euclid gamers-against-weed humanoid knowledge mister scp sentient telekinetic 
scp-2587,Safe,,amorphous aquatic biological humanoid safe scp 
scp-2588,Euclid,,alive biohazard biological cadaver contagion euclid extremity humanoid ocular ontokinetic reanimation sapient scp self-replicating sentient skeletal 
scp-2589,Neutralized,,biological building euclid mind-affecting neutralized reviewers-spotlight scp spacetime transfiguration 
scp-259,Keter,,keter portal recording scp visual 
scp-2590,Keter,,compulsion humanoid keter memory-affecting scp spacetime vehicle 
scp-2591,Euclid,,cadaver euclid humanoid prometheus reanimation sapient scp sentient 
scp-2592,Euclid,site-06-2,alive empathic euclid humanoid scp sentient telepathic 
scp-2593,Safe Euclid,,euclid humanoid sapient scp sentient teleportation 
scp-2594,Safe,,co-authored extradimensional mind-affecting musical safe scp structure subterranean temporal 
scp-2595,keter,,aquatic autonomous ectoentropic humanoid keter sapient scp self-replicating sentient stone 
scp-2596,Euclid (previously Safe),,auditory euclid hallucination horizon-initiative religious scp spacetime teleportation visual wooden 
scp-2597,Safe,site-45,artifact event-featured gravity metallic physics safe scp 
scp-2598,Safe,site-18,alive insect lepidopteran safe sapient scp sentient 
scp-2599,Euclid,,alive auditory compulsion euclid humanoid ontokinetic probability sapient scp sentient telekinetic transfiguration 
scp-26,Euclid,,building euclid humanoid mind-affecting scp sleep 
scp-260,Euclid,,autonomous euclid hostile inscribed scp stone teleportation 
scp-2600,Euclid,site-77,2000 appliance arcadia electronic euclid game humanoid mind-affecting scp unusual-incidents-unit 
scp-2601,Keter,,antimemetic concept contagion infohazard keter meta ontokinetic scp 
scp-2602,esoteric-class,,bibliothetic building esoteric-class infohazard memetic meta mind-affecting scp 
scp-2603,Euclid,,alive euclid gru-division-p humanoid mtf2016 oneiroi ontokinetic sapient scp sentient transfiguration 
scp-2604,Safe,,cognitohazard memory-affecting mind-affecting observational safe scp visual wooden 
scp-2605,Euclid,,euclid hallucination humanoid intangible sc2015 scp 
scp-2606,Safe,,food insect safe scp telepathic 
scp-2607,euclid,,adult biological euclid microscopic online redirect scp sexual virus 
scp-2608,Safe,site-45,alive animal insect safe scp species 
scp-2609,Euclid,,electrical euclid furniture light scp teleportation 
scp-261,Safe,,appliance ectoentropic exchange food safe scp 
scp-2610,keter,,adult genetic humanoid keter neutralized redirect reproductive sapient scp sentient unusual-incidents-unit 
scp-2611,Euclid,,amorphous biological compulsion euclid humanoid memory-affecting mind-affecting sapient scp sentient 
scp-2612,Keter Safe,,artifact cognitohazard empathic k-class-scenario mind-affecting observational safe scp sculpture visual 
scp-2613,Euclid,site-88,cadaver euclid humanoid military reanimation scp sentient temporal uncontained vehicle 
scp-2614,Safe,,inscribed media narrative recording safe scp 
scp-2615,Keter,,alive historical humanoid keter ontokinetic sapient scp sentient species temporal 
scp-2616,Safe,site-17,alive animal insect safe sapient scp sentient species 
scp-2617,Safe,,autonomous computer gru-division-p historical humanoid meteorological safe scp statue structure transmission weapon 
scp-2618,safe,site-65,electrical extradimensional safe scp teleportation 
scp-2619,Euclid,site-19,alive animal avian euclid scp transfiguration 
scp-262,Euclid,,clothing euclid extradimensional extremity historical scp the-administrator 
scp-2620,Euclid,,appliance electrical euclid online scp telekinetic 
scp-2621,Euclid,,building city euclid historical humanoid religious scp tau-5-samsara 
scp-2622,Safe,,alive featured humanoid safe sapient scp sentient subterranean 
scp-2623,Euclid,,cadaver euclid humanoid scp teleportation 
scp-2624,Keter,,alive animal artifact auditory canine extraterrestrial hallucination hiscon2017 historical hive-mind keter satellite scp self-replicating sentient sleep teleportation uncontained 
scp-2625,Euclid,,biological euclid humanoid location musical sapient scp sentient 
scp-2626,Safe,,artifact artistic cognitohazard mechanical photographic recording safe scp visual 
scp-2627,Safe,,extradimensional location portal safe sc2015 scp 
scp-2628,keter,,addictive computer keter online scp telepathic 
scp-2629,Keter,,game humanoid intangible keter location sapient scp sentient subterranean 
scp-263,Safe,site-18,appliance electronic fire game knowledge rewrite safe scp sentient 
scp-2630,Euclid,,cadaver corporate ectoentropic euclid mechanical prometheus scp temporal third-law 
scp-2631,Keter,,extraterrestrial k-class-scenario keter satellite scp sphere transmission 
scp-2632,Safe,site-88,biological doctor-cimmerian humanoid indestructible safe sapient scp sentient 
scp-2633,Euclid,site-81,animal arthropod biological euclid gaseous hiscon2017 historical scp 
scp-2634,Keter,,extradimensional keter narrative sapient scp sentient telepathic 
scp-2635,Euclid - Yellow,,antimemetic are-we-cool-yet chaos-insurgency euclid global-occult-coalition gru-division-p marshall-carter-and-dark plant sarkic scp serpents-hand unusual-incidents-unit 
scp-2636,Keter,,alive animal auditory cadaver keter predatory reptilian sapient scp sentient skeletal species structure toxic 
scp-2637,Safe,site-18,electromagnetic maria-jones safe scp stone transmission 
scp-2638,Safe,,building compulsion safe scp 
scp-2639,Euclid (formerly Keter),,computer electrical electronic euclid extradimensional game military scp 
scp-264,Safe,,safe sapient scp sentient skeletal statue transfiguration 
scp-2640,Euclid,,euclid intangible light location mobile scp sphere temporal 
scp-2641,safe,,biohazard fungus neurological parasitic safe scp unusual-incidents-unit 
scp-2642,Euclid,,euclid infohazard memetic sc2015 scp telepathic 
scp-2643,Euclid,,euclid feline memory-affecting scp 
scp-2644,Euclid,,euclid humanoid scp 
scp-2645,Euclid,,euclid extradimensional furniture mimetic portal scp wooden 
scp-2646,Keter,,building cognitohazard keter memetic memory-affecting scp teleportation 
scp-2647,Euclid (pending Keter),,euclid exchange online probability scp uncontained 
scp-2648,Safe (pending Euclid),,amorphous biological mobile organic safe scp 
scp-2649,Euclid,,appliance arachnid euclid extradimensional liquid scp sentient 
scp-265,Euclid,site-45,autonomous euclid mobile scp sentient vehicle 
scp-2650,Euclid,,biological euclid humanoid mind-affecting sapient scp sentient tool 
scp-2651,safe,area-32,arthropod extraterrestrial intangible map metallic moon safe sarkic scp second-hytoth sphere 
scp-2652,Safe,,alive electronic humanoid mechanical safe sapient scp sentient 
scp-2653,Safe,,cognitohazard food gustatory mind-affecting safe scp sensory visual 
scp-2654,Safe,,humanoid safe sapient scp sentient toy 
scp-2655,Neutralized Euclid,,contagion euclid inscription light radioactive ranine scp 
scp-2656,Safe,,electromagnetic electronic neurological radioactive reviewers-spotlight safe scp 
scp-2657,Euclid,,acoustic alive arachnid euclid mimetic predatory scp sentient toxic 
scp-2658,Safe,site-65,artifact cognitohazard gamers-against-weed inscribed mind-affecting safe scp visual 
scp-2659,Euclid,,animal aquatic biological cetacean compulsion euclid scp 
scp-266,Euclid,site-18,autonomous euclid light scp sentient thermodynamic 
scp-2660,Euclid,,appliance broken-god cognitohazard euclid infohazard meta scp sensory visual 
scp-2661,Euclid,,addictive chemical compulsion euclid mathematical mind-affecting scp sleep 
scp-2662,Euclid Keter,,adaptive alive cephalopodic cognitohazard compulsion humanoid keter kindness sapient scp sentient 
scp-2663,Euclid,,biological compulsion euclid fungus microscopic sapient scp sentient telepathic 
scp-2664,Keter Neutralized,,biological global-occult-coalition gru-division-p hiscon2017 keter mind-affecting neutralized scp sentient simon-pietrykau telepathic the-coldest-war third-law 
scp-2665,Safe,,audio auditory building co-authored hallucination safe scp tactile tool visual 
scp-2666,Euclid,,autonomous euclid geological humanoid location scp self-repairing self-replicating stone 
scp-2667,Safe,,acoustic extraterrestrial location safe scp statue transmission 
scp-2668,safe,site-45,automaton ethics-committee extradimensional historical humanoid loop performance researcher-lloyd safe scp sentient 
scp-2669,Keter,,d-con2016 ectoentropic extraterrestrial foundation-made heimdall keter mobile scp spacetime telepathic 
scp-267,Euclid,,alive carnivorous euclid scp species 
scp-2670,Euclid,site-45,alive automaton biological euclid extraterrestrial humanoid metamorphic portal religious sapient scp sentient spacetime 
scp-2671,Safe,,ectoentropic observational safe sapient scp sentient toy 
scp-2672,Safe,,acoustic auditory electronic safe scp 
scp-2673,Euclid,,auditory cognitohazard euclid memetic meta parasitic poetry scp visual 
scp-2674,Keter,,aquatic biological geological humanoid keter portal sapient scp sentient 
scp-2675,Keter,,aquatic gru-division-p hostile keter metamorphic radioactive scp teleportation 
scp-2676,Euclid,,empathic euclid furniture scp sleep wooden 
scp-2677,Keter (Formerly Euclid),,2000 container electronic foundation-made keter mind-affecting sapient scp sentient the-trashfire 
scp-2678,Safe,,abnormalities auditory biological city extradimensional mind-affecting musical religious safe scp 
scp-2679,Euclid,,cadaver euclid inscribed location reanimation scp self-replicating 
scp-268,Euclid,,antimemetic clothing euclid memory-affecting mind-affecting scp serpents-hand uncontained 
scp-2680,keter,,biohazard chicago-spirit keter mimetic parasitic scp virus 
scp-2681,Euclid,,alive compulsion empathic euclid humanoid sapient scp sentient 
scp-2682,Neutralized,,2000 extradimensional neutralized pattern-screamer plant reviewers-spotlight sapient scp sentient spacetime telepathic 
scp-2683,Euclid,,animal euclid location scp spacetime temporal 
scp-2684,Safe,,aquatic extradimensional location safe scp 
scp-2685,esoteric-class,,document esoteric-class infohazard meta mind-affecting scp 
scp-2686,Euclid,area-32,euclid event-featured extraterrestrial humanoid location moon sapient scp sentient telekinetic 
scp-2687,Keter (Safe classification pending containment),site-77,antimemetic artifact chaos-insurgency genetic keter medical prometheus scp 
scp-2688,Euclid,,biohazard broken-god city ectoentropic euclid reclamation reproductive sarkic scp 
scp-2689,safe,,alive animal aquatic empathic piscine safe scp sentient visual 
scp-269,Safe,site-18,indestructible jewelry medical metamorphic safe scp 
scp-2690,Keter,,k-class-scenario keter sc2015 scp transfiguration 
scp-2691,Euclid,,euclid observational scp structure temporal 
scp-2692,euclid,,biological building euclid extradimensional gravity humanoid scp subterranean temporal 
scp-2693,Pending,,alive animal feline pending scp structure teleportation 
scp-2694,Safe,,animal autonomous cadaver canine reanimation safe scp sentient skeletal 
scp-2695,Safe,,ectoentropic safe scp self-replicating tool transfiguration 
scp-2696,Keter,,amorphous building compulsion hallucination humanoid intangible keter mind-affecting radioactive scp skeletal 
scp-2697,Euclid,,amorphous euclid fire geological liquid location scp self-repairing subterranean 
scp-2698,Euclid,site-14,cephalopodic computer electronic euclid extradimensional online sapient scp sentient 
scp-2699,Safe,,alive animal dinosaurian feline humanoid ranine reptilian safe scp sentient toy 
scp-27,Euclid,,alive animal compulsion contagion euclid humanoid insect murine scp 
scp-270,Euclid,,appliance audio auditory electrical euclid language mathematical predictive scp 
scp-2700,Safe,,2000 computer entropic k-class-scenario keter mechanical scp temporal weapon 
scp-2701,Safe,,acoustic audio building extradimensional safe scp sensory temporal 
scp-2702,Keter,,automaton humanoid keter sapient scp sentient transmission 
scp-2703,Euclid,site-98,animal avian euclid knowledge sapient scp sentient teleportation 
scp-2704,Keter,,alive arthropod city ectoentropic hostile insect keter scp sleep weapon 
scp-2705,Euclid,,euclid geological mobile scp subterranean transmission 
scp-2706,Keter,,alive arboreal co-authored ectoentropic keter location plant scp 
scp-2707,Euclid,,alive animal euclid sapient sciurine scp sentient telepathic 
scp-2708,euclid,,are-we-cool-yet cognitohazard euclid memetic mind-affecting scp sexual visual 
scp-2709,Euclid,,animal euclid insect location predatory scp 
scp-271,Keter,,artifact broken-god engraved keter metallic scp self-replicating 
scp-2710,Euclid Keter,,hallucination keter meta sapient saturn-deer scp sensory sentient 
scp-2711,Safe,,artifact broken-god chemical engraved liquid metallic safe scp xia-dynasty 
scp-2712,"Safe There's something going on, seems to keep us from being able to edit this slot. Probably whatever's making you write in the format.",,document media meta safe sapient scp sentient telepathic 
scp-2713,Safe,site-88,building doctor-cimmerian extradimensional extraterrestrial global-occult-coalition humanoid performance safe sapient scp sentient sun the-gulf 
scp-2714,Safe,site-88,animal are-we-cool-yet arthropod document ectoentropic hive-mind immobile narrative safe sarkic scp 
scp-2715,Euclid,,alive biohazard chaos-insurgency euclid humanoid sapient scp 
scp-2716,Euclid,site-98,artifact euclid extraterrestrial scp statue teleportation 
scp-2717,Euclid,,amorphous animal biological euclid scp subterranean 
scp-2718,,,esoteric-class infohazard knowledge meta scp the-old-man 
scp-2719,Keter,,concept doctor-bright hard-to-kill-reptile keter scp 
scp-272,Safe,,engraved metallic mind-affecting safe scp shadow telekinetic tool 
scp-2720,Safe,,autonomous building extradimensional safe scp spacetime 
scp-2721,Keter-provisi Euclid,,amorphous artistic biological bones co-authored euclid extraterrestrial online sapient satellite scp sentient transmission 
scp-2722,Safe,,black-rabbit-company engraved safe scp stone telepathic 
scp-2723,Euclid,,animal automaton entropic euclid extradimensional insect lepidopteran liquid pitch-haven scp 
scp-2724,Euclid,site-14,alive euclid extremity humanoid radioactive sapient scp sentient 
scp-2725,Euclid,site-88,airborne alive animal avian cadaver euclid insect ophidian reanimation reptilian scp vehicle 
scp-2726,euclid,,euclid gamers-against-weed online sapient scp sentient 
scp-2727,Euclid,,animal autonomous euclid humanoid scp structure subterranean 
scp-2728,Euclid,,agent-laferrier building euclid extradimensional portal scp 
scp-2729,Euclid,,agent-laferrier computer euclid intangible military scp visual 
scp-273,Euclid,,euclid fire humanoid sapient scp sentient 
scp-2730,Euclid,,avian euclid observational sapient scp sentient visual 
scp-2731,Euclid,,building euclid extradimensional food portal scp 
scp-2732,Safe,,alagadda autonomous document ectoentropic hanged-king performance safe scp wooden 
scp-2733,Safe,,building extremity safe sc2015 scp telepathic 
scp-2734,Neutralized Euclid,,biological euclid extradimensional humanoid neutralized scp sentient species 
scp-2735,Safe,,alive animal aquatic extraterrestrial safe scp sentient 
scp-2736,"Euclid (SCP-2736-1), Keter (SCP-2736-2) Neutralized",,hiscon2017 historical humanoid keter neutralized ritual sapient scp self-replicating sentient uncontained 
scp-2737,Safe,,animal cadaver compulsion memetic mind-affecting safe scp 
scp-2738,Euclid,,computer currency electronic euclid exchange scp sentient 
scp-2739,Safe,,artistic building extradimensional safe scp 
scp-274,Keter,,artistic biohazard biological building chemical humanoid keter predatory scp self-replicating 
scp-2740,euclid,site-81,building cognitohazard empathic euclid memetic scp spacetime 
scp-2741,Safe Neutralised,,acoustic container mind-affecting neutralized safe scp wooden 
scp-2742,euclid,,alive animal aquatic euclid ontokinetic scp second-hytoth species 
scp-2743,keter,,biological cadaver co-authored extradimensional extraterrestrial humanoid keter religious satellite scp 
scp-2744,esoteric-class,,esoteric-class eurtec global-occult-coalition hostile humanoid infohazard nameless nightmarefest sapient scp sentient uncontained 
scp-2745,Safe,,audio building extradimensional portal safe scp spacetime 
scp-2746,euclid,site-45,animal euclid extradimensional pitch-haven portal religious scp structure subterranean transfiguration 
scp-2747,Euclid Keter,,infohazard keter media meta narrative online scp uncontained 
scp-2748,Safe,,cadaver global-occult-coalition inscribed location organic safe scp transfiguration vehicle 
scp-2749,Safe,site-65,clothing corporate knowledge safe sapient scp sentient tactile 
scp-275,Safe,,doctor-glass humanoid indestructible rewrite safe sapient scp sentient 
scp-2750,Euclid,,alive animal asci euclid historical humanoid metamorphic sapient scp sentient species 
scp-2751,Safe,,alive animal canine physics safe scp sentient 
scp-2752,Euclid,,cognitohazard document euclid knowledge scp teleportation visual 
scp-2753,Keter,,are-we-cool-yet artistic building chaos-insurgency entropic game keter mathematical scp toy 
scp-2754,Safe,,light meteorological performance safe scp 
scp-2755,Safe,,cadaver liquid performance safe sapient sc2015 scp 
scp-2756,Keter,,biological contagion keter scp transfiguration 
scp-2757,Safe,,dr-wondertainment ectoentropic mechanical recording safe scp tool 
scp-2758,Safe1,,alive auditory humanoid loop meta observational ritual safe sapient scp 
scp-2759,thaumiel,,artifact cognitohazard extradimensional scp structure thaumiel 
scp-276,Euclid,,euclid scp temporal vehicle 
scp-2760,Safe,,airborne animal autonomous meteorological mobile safe scp sentient 
scp-2761,Euclid,,adaptive alive animal aquatic biohazard carnivorous chemical euclid genetic piscine plant ranine reptilian scp selachian toxic 
scp-2762,Euclid,,autonomous engraved euclid event-featured extraterrestrial gru-division-p moon scp sculpture stone teleportation transfiguration uncontained 
scp-2763,euclid,,alive euclid event-featured humanoid meta narrative sapient scp sentient 
scp-2764,Keter,,biological keter mtf2016 observational sapient scp sentient spacetime telepathic temporal 
scp-2765,Safe Neutralized,,city entropic location neutralized safe scp temporal 
scp-2766,safe,,ectoentropic liquid religious safe scp stone structure subterranean 
scp-2767,Safe,,empathic liquid safe scp sensory spacetime 
scp-2768,Euclid,,alive euclid humanoid sapient scp sentient 
scp-2769,Euclid,,alive animal arthropod euclid infohazard meta sapient scp sentient 
scp-277,Euclid,,city euclid intangible scp visual 
scp-2770,Euclid,,aquatic euclid humanoid scp sentient vehicle 
scp-2771,Euclid,,euclid exchange humanoid location sc2015 scp uncontained vehicle 
scp-2772,Euclid,,ectoentropic euclid kindness location scp transfiguration transmission 
scp-2773,Euclid,,building co-authored euclid hallucination scp thermal 
scp-2774,Keter,,humanoid keter media memetic scp 
scp-2775,Euclid,,alive euclid extraterrestrial sapient scp sentient 
scp-2776,Euclid,,automaton euclid historical humanoid marshall-carter-and-dark sapient scp sentient 
scp-2777,Euclid,,2000 euclid extraterrestrial humanoid meta sapient scp sentient structure vehicle 
scp-2778,Safe,,d-con2016 location loop portal safe scp spacetime 
scp-2779,Safe,area-12,alive animal computer featured safe scp 
scp-278,Safe,,arachnid autonomous mechanical safe scp 
scp-2780,Safe,,auditory building safe scp temporal 
