scp-4032,Safe,,biohazard gaseous gustatory plant safe scp 
scp-4033,Safe,,auditory ectoentropic food game indestructible safe scp sensory tactile 
scp-4034,Euclid,,co-authored ectoentropic euclid scp self-replicating temporal 
scp-4035,safe,area-27,appliance gaseous humanoid ontokinetic safe sapient scp sentient 
scp-4036,Keter1,,4000 city general-bowe historical k-class-scenario keter religious sarkic scp 
scp-4037,Safe,,jewelry metallic radioactive safe scp telepathic 
scp-4038,Keter,,contagion keter scp sentient sleep 
scp-4039,Keter,,entropic keter scp spacetime thermodynamic 
scp-404,Safe,,container document memory-affecting photographic rewrite safe scp telepathic 
scp-4040,keter,site-81,4000 alive geological humanoid infohazard keter narrative probability s&c-plastics sapient scp sentient 
scp-4041,Keter,,4000 animal avian dinosaurian intangible keter ritual sapient scp sentient stone swarm 
scp-4042,Keter,,alive ethics-committee humanoid keter memory-affecting ontokinetic sapient scp sentient uncontained 
scp-4043,Archon1,,archon biohazard k-class-scenario meta planet sapient scp telepathic 
scp-4044,Euclid,,euclid ontokinetic scp uncontained 
scp-4045,Keter,,keter mind-affecting scp sexual transfiguration vehicle 
scp-4046,Safe,site-45,computer dr-wondertainment eric knowledge memory-affecting mind-affecting safe scp toy wonderful-world 
scp-4047,Euclid,,artistic ectoentropic ethics-committee euclid humanoid ritual sapient scp sentient 
scp-4048,Extraterrestrial,,airborne extraterrestrial keter scp sleep telekinetic vehicle 
scp-4049,keter,,extradimensional fire hostile keter portal sapient scp sentient 
scp-405,euclid,,contagion euclid mind-affecting scp telepathic 
scp-4050,Euclid,,city euclid extradimensional portal scp 
scp-4051,keter,site-14,alive deepwell-catalog doctor-cimmerian ethics-committee extradimensional humanoid keter rainer-miller reviewers-spotlight sapient scp sentient spacetime 
scp-4052,archon,area-27,archon city concept extradimensional hostile humanoid location sapient scp sentient species 
scp-4053,Euclid,,cognitohazard euclid scp sculpture visual 
scp-4054,Safe,,antimemetic electronic game media safe scp 
scp-4055,Euclid,site-14,alive euclid humanoid k-class-scenario paradox sapient scp sentient temporal 
scp-4056,Euclid,site-14,black-queen co-authored doctor-clef doctor-gears end-of-death euclid extradimensional humanoid location scp 
scp-4057,euclid,site-18,4000 alive cognitohazard euclid humanoid k-class-scenario marshall-carter-and-dark memetic meta sapient scp sentient visual 
scp-4058,Safe,,acoustic bibliothetic location safe scp unusual-incidents-unit 
scp-4059,euclid,,animal biological carnivorous euclid location predatory ritual sarkic scp sentient 
scp-406,Euclid,,euclid humanoid scp sleep structure subterranean teleportation 
scp-4060,safe,site-65,broken-god empathic exchange memory-affecting predictive safe scp tool 
scp-4061,safe,site-65,animal cadaver canine chaos-insurgency electromagnetic genetic photographic radioactive safe scp wilsons-wildlife 
scp-4062,Safe,,alive animal canine ectoentropic ethics-committee military safe scp 
scp-4063,Keter,,cliche2019 humanoid infohazard jewelry parasitic safe sapient scp 
scp-4064,keter,,alive compulsion empathic hive-mind humanoid keter reviewers-spotlight scp 
scp-4065,keter,,cognitohazard foundation-made keter memetic scp uncontained visual 
scp-4066,euclid,,4000 cool-war-2 euclid extraterrestrial historical scp second-hytoth 
scp-4067,Keter,,alive daevite extradimensional global-occult-coalition humanoid insect keter sapient sarkic scp sentient 
scp-4068,Keter,,auditory cognitohazard corporate keter language memetic mind-affecting scp visual 
scp-4069,safe,,4000 ad-astra agent-trauss extradimensional location memory-affecting safe scp 
scp-407,Neutralized,site-18,acoustic biological euclid fungus musical neutralized plant scp serpents-hand transfiguration 
scp-4070,Euclid,,euclid scp vehicle 
scp-4071,neutralized,,computer k-class-scenario manna-charitable-foundation memory-affecting neutralized scp 
scp-4072,Keter,site-14,cognitohazard computer keter memetic mind-affecting online scp visual 
scp-4073,neutralized,,auditory cliche2019 contagion gaseous neutralized olfactory scp sensory tactile 
scp-4074,Safe,,biological light miniature physics plant safe scp sun 
scp-4075,Keter,,alive animal avian k-class-scenario keter sapient scp sentient teleportation 
scp-4076,Safe,,inscribed observational recording safe scp telekinetic 
scp-4077,Euclid Keter,,4000 city global-occult-coalition historical hmfscp keter obskura scp spacetime thad-xyank 
scp-4078,neutralized,,cliche2019 historical humanoid neutralized ontokinetic sapient scp sentient 
scp-4079,Euclid,,4000 euclid global-occult-coalition mathematical memetic scp 
scp-408,Safe,site-14,airborne alive cadaver doctor-kondraki hive-mind insect lepidopteran safe scp 
scp-4080,Safe,,language media predictive recording safe scp 
scp-4081,Neutralized,,building document light neutralized predictive scp sentient spacetime teleportation 
scp-4082,Safe,,knowledge physics safe scp transmission 
scp-4083,Euclid,,acoustic building compulsion euclid scp skeletal temporal 
scp-4084,Euclid,,auditory electronic euclid hallucination recording scp 
scp-4085,Safe (Presumed Neutralized),,building currency ectoentropic empathic neutralized scp 
scp-4086,euclid,,euclid extradimensional portal scp structure subterranean 
scp-4087,Euclid,,euclid scp weapon 
scp-4088,euclid,area-27,autonomous carnivorous euclid mobile musical predatory scp sentient 
scp-4089,Keter,,biological dental exchange keter parasitic predatory probability ritual scp 
scp-409,Keter,,crystalline keter scp self-replicating transfiguration 
scp-4090,Safe,,container extradimensional gamers-against-weed portal safe scp 
scp-4091,Euclid,,alive animal canine euclid sapient scp sentient teleportation 
scp-4092,Euclid,,biological euclid humanoid indestructible physics sapient scp sentient 
scp-4093,Keter,,keter mind-affecting scp uncontained 
scp-4094,Keter,,alive bacteria k-class-scenario keter microscopic omnivorous scp species 
scp-4095,Safe,,document knowledge observational safe scp visual 
scp-4096,esoteric-class,,concept esoteric-class meta scp 
scp-4097,Safe,,ectoentropic military safe scp weapon 
scp-4098,thaumiel,,building co-authored cognitohazard foundation-made infohazard memetic miscommunications scp thaumiel visual 
scp-4099,Safe,site-65,4000 abnormalities agent-kazmarek document safe scp 
scp-41,Safe,,alive humanoid safe sapient scp sentient telepathic 
scp-410,Safe,site-19,alive event-featured insect language safe scp species 
scp-4100,esoteric-class,,4000 broken-god esoteric-class planet satellite scp transmission 
scp-4101,thaumiel,,4000 computer foundation-made mechanical scp temporal thaumiel 
scp-4102,Euclid,,building compulsion euclid humanoid immobile location observational predictive scp stone 
scp-4103,Keter,,acoustic concept empathic historical keter memetic musical parasitic scp weapon 
scp-4104,N/A,,alive cliche2019 compulsion esoteric-class humanoid k-class-scenario memory-affecting ontokinetic sapient scp sentient uncontained 
scp-4105,Keter,,aquatic autonomous historical hostile humanoid keter location scp 
scp-4106,safe,,adult extradimensional extraterrestrial online recording redirect safe scp sexual 
scp-4107,euclid,,antimemetic cadaver euclid humanoid loop meta scp 
scp-4108,Safe,site-65,alive arboreal historical mobile plant safe scp 
scp-4109,safe,area-27,document ectoentropic food narrative plant safe scp 
scp-411,thaumiel,,future humanoid paradox predictive scp thaumiel 
scp-4110,euclid,,clothing dr-wondertainment euclid observational scp sensory visual 
scp-4111,Euclid,,artifact crystalline equine euclid extradimensional game location ritual scp 
scp-4112,Safe,,4000 co-authored meta musical ontokinetic safe scp temporal the-administrator 
scp-4113,Hera (Hostile/High Utility),,esoteric-class extraterrestrial hostile radioactive scp sotm spacetime vehicle 
scp-4114,Keter,,antimemetic dread&circuses herman-fuller humanoid keter manny performance scp uncontained 
scp-4115,neutralized,,corrosive crystalline geological jam-con2019 location neutralized scp stone subterranean 
scp-4116,Safe,,antimemetic humanoid predictive safe sapient scp sentient sleep uncontained 
scp-4117,Safe,,co-authored furniture musical performance safe scp 
scp-4118,Safe,,animal autonomous dinosaurian dr-wondertainment safe scp sentient toy 
scp-4119,Euclid,,alive chemical euclid extradimensional humanoid liquid ocular sapient scp sentient visual 
scp-412,Safe,site-18,artifact compulsion safe scp transfiguration 
scp-4120,Euclid,,animal canine euclid probability rewritable scp 
scp-4121,esoteric-class,,concept esoteric-class ethics-committee k-class-scenario paradox scp spacetime temporal uncontained 
scp-4122,Safe,,artifact extradimensional inscribed paradox safe scp temporal 
scp-4123,Euclid,,autonomous container document ectoentropic euclid game scp sentient telekinetic 
scp-4124,Euclid,,are-we-cool-yet artistic euclid mind-affecting probability scp tactile visual 
scp-4125,Euclid,,antimemetic auditory clothing cognitohazard euclid fifthist humanoid intangible mind-affecting ontokinetic sapient scp sentient 
scp-4126,Safe,area-12,acoustic autonomous safe sapient scp sentient 
scp-4127,neutralized,,currency engraved loop metallic neutralized probability scp 
scp-4128,euclid,,euclid humanoid sapient scp sentient 
scp-4129,Keter,,building food keter mind-affecting scp teleportation uncontained 
scp-413,Safe,,acoustic auditory building neurological safe sapient scp spacetime 
scp-4130,Keter Uncontained (pending) Pending,,4000 humanoid keter ontokinetic sapient scp sentient temporal uncontained 
scp-4131,euclid,,animal aquatic ectoentropic euclid invertebrate military scp sentient telepathic weapon 
scp-4132,Safe,,4000 computer ectoentropic electronic safe scp temporal 
scp-4133,Safe,,addictive cognitohazard document mind-affecting safe scp visual 
scp-4134,euclid,,building ectoentropic euclid extremity historical mimetic mind-affecting predictive scp thermal weapon 
scp-4135,Keter,,avian hostile humanoid indestructible keter scp 
scp-4136,Euclid,,alive euclid humanoid memory-affecting rewrite sapient scp sentient 
scp-4137,Safe,,deer-college extradimensional oneiroi safe scp spacetime vehicle 
scp-4138,Keter,,extraterrestrial keter planet scp uncontained 
scp-4139,Safe,,acoustic appliance artistic chemical document dr-wondertainment ectoentropic light metallic safe scp self-repairing spacetime 
scp-414,Keter,,auditory cognitohazard hive-mind humanoid keter kindness mind-affecting sapient scp sentient uncontained 
scp-4140,Euclid1,,daevite ectoentropic euclid immobile indestructible mind-affecting musical ritual sarkic scp self-replicating subterranean 
scp-4141,Safe,,are-we-cool-yet building extradimensional safe scp 
scp-4142,Keter,,alive animal crystalline dinosaurian electromagnetic extraterrestrial gaseous keter light reptilian scp species sun 
scp-4143,euclid,,biological euclid extradimensional k-class-scenario metamorphic portal scp serpents-hand spacetime wanderers-library 
scp-4144,keter,,antimemetic concept extradimensional humanoid keter memory-affecting reviewers-spotlight scp uncontained 
scp-4145,keter,,concept empathic jam-con2019 keter memory-affecting oneiroi scp sleep 
scp-4146,Safe,,antimemetic chicago-spirit currency organic safe scp transfiguration 
scp-4147,Safe,,document ethics-committee historical knowledge memetic memory-affecting narrative safe scp 
scp-4148,Insectoid,,animal ectoentropic euclid extraterrestrial insect scp 
scp-4149,safe,,alive animal are-we-cool-yet extradimensional humanoid safe sapient scp sentient 
scp-415,Safe,,alive extradimensional humanoid rewrite safe sapient scp self-repairing sentient 
scp-4150,Keter,site-18,are-we-cool-yet auditory cognitohazard compulsion contagion keter scarlet-king scp 
scp-4151,Euclid,,alive arboreal ectoentropic euclid food humanoid metamorphic mind-affecting plant sapient scp sentient teleportation 
scp-4152,Safe,,are-we-cool-yet artistic memetic memory-affecting safe scp visual 
scp-4153,Keter,,humanoid keter performance sapient scp sentient statue uncontained 
scp-4154,keter,,alive antimemetic keter mind-affecting parasitic scp vermian 
scp-4155,Euclid,,alive animal ectoentropic euclid feline food humanoid predatory sapient scp sentient 
scp-4156,Thaumiel,site-98,city foundation-made genetic historical memory-affecting scp sensory thaumiel 
scp-4157,Keter,,animal biological canine document hostile keter scp sentient 
scp-4158,Euclid,,biological bovine ectoentropic euclid omnivorous scp 
scp-4159,Euclid,,alive aquatic cognitohazard compulsion euclid light plant predatory scp sentient species visual 
scp-416,Euclid,,euclid location scp spacetime 
scp-4160,Keter Neutralized,site-64,4000 compulsion historical mind-affecting neutralized scp telepathic twisted-pines 
scp-4161,safe,,acoustic audio cadaver electrical electronic goi2019 humanoid prize-feature safe scp 
scp-4162,Euclid,,euclid intangible mobile predatory sapient scp sentient 
scp-4163,keter,site-18,alive computer electronic exchange humanoid k-class-scenario keter sapient scp sentient 
scp-4164,Safe,site-18,autonomous document reviewers-spotlight ritual safe scp 
scp-4165,Euclid,,euclid humanoid metamorphic sapient scp sentient teleportation 
scp-4166,Euclid,,alive cognitohazard euclid hallucination humanoid mind-affecting ontokinetic religious sapient scp sentient shadow visual 
scp-4167,Keter,site-65,alive biological keter mind-affecting neurological parasitic scp species vermian 
scp-4168,Euclid,site-14,alive euclid humanoid jewelry reviewers-spotlight rewrite sapient scp self-repairing sentient visual 
scp-4169,Euclid,,animal arthropod biological euclid geological scp subterranean 
scp-417,Euclid (Potentially Keter),,alive arboreal euclid plant scp species 
scp-4170,Keter,,autonomous extraterrestrial keter physics sapient scp sentient 
scp-4171,Euclid,site-18,alive cliche2019 euclid humanoid metallic predictive sapient scp sentient 
scp-4172,Euclid Neutralized,,artistic humanoid neutralized ontokinetic sapient scp sentient transfiguration 
scp-4173,euclid,,cadaver euclid exchange hostile intangible scp sentient 
scp-4174,safe,,adult alive antimemetic biohazard cadaver humanoid redirect reproductive ritual safe scp sexual 
scp-4175,esoteric-class,site-14,deepwell-catalog doctor-cimmerian esoteric-class ethics-committee humanoid prize-feature sapient scp 
scp-4176,Keter,,co-authored currency dado keter scp weapon 
scp-4177,Keter,,document keter scp sleep telekinetic 
scp-4178,Euclid,,alive animal apian arachnid arthropod euclid sapient scp sentient 
scp-4179,Euclid,,4000 children-of-the-night daevite euclid historical humanoid language memory-affecting scarlet-king scp stone transfiguration 
scp-418,safe,,humanoid marshall-carter-and-dark safe scp sentient 
scp-4180,Safe,,auditory building cognitohazard geological jam-con2019 safe scp subterranean 
scp-4181,Euclid,,acoustic alive avian building euclid hostile indestructible metamorphic ritual scp sentient 
scp-4182,keter,site-0,cadaver cognitohazard keter location mind-affecting scp subterranean transfiguration video visual 
scp-4183,Safe,,artifact observational safe scp 
scp-4184,Safe,,auditory cognitohazard document musical safe scp tactile telepathic 
scp-4185,Safe,,humanoid location paradox ritual safe sapient scp sentient shadow temporal 
scp-4186,Neutralized (Formerly Keter),,airborne artifact document meteorological neutralized scp 
scp-4187,Euclid,,alive building euclid food hostile predatory scp sentient 
scp-4188,euclid,,addictive chemical director-gillespie euclid gustatory jam-con2019 medical oneiroi ontokinetic scp sleep 
scp-4189,Keter,,alive aquatic invertebrate keter reproductive sapient scp sensory telepathic thermal transfiguration transmission uncontained 
scp-419,Safe,,city extradimensional featured glass rewrite safe scp spacetime visual 
scp-4190,safe,,amorphous cognitohazard document hallucination jam-con2019 safe scp shark-punching-center sleep visual 
scp-4191,Euclid,,alive animal euclid fire scp sentient 
scp-4192,safe,site-98,electromagnetic microscopic miniature physics reviewers-spotlight safe scp tactile transmission 
scp-4193,Safe,site-19,biohazard dado medical safe scp 
scp-4194,Euclid,,alive animal avian euclid hive-mind k-class-scenario scp species 
scp-4195,Euclid,,alive ectoentropic euclid plant scp 
scp-4196,keter,,building humanoid keter memory-affecting sapient scp teleportation uncontained 
scp-4197,euclid,,alive euclid humanoid medical memoria-adytum reviewers-spotlight sapient sarkic scp sentient transfiguration 
scp-4198,euclid,site-19,autonomous clothing euclid location scp 
scp-4199,Keter,,4000 alive antimemetic doctor-bright doctor-cimmerian doctor-clef doctor-gears doctor-mann ethics-committee factory humanoid keter memory-affecting sapient scp sentient uncontained 
scp-42,Safe,,alive animal equine mind-affecting rewrite safe scp sentient 
scp-420,Safe,,container liquid safe scp self-replicating transfiguration 
scp-4200,archon,,4000 alive archon extradimensional historical humanoid location sapient scp sentient weapon 
scp-4201,Keter,,autonomous electronic humanoid keter sapient scp sentient 
scp-4202,Safe,,neurological safe scp sleep 
scp-4203,euclid,,adult euclid extradimensional insect portal redirect ritual scp sexual 
scp-4204,safe,,acoustic currency historical light metallic meteorological reviewers-spotlight safe scp unusual-incidents-unit 
scp-4205,keter,,audio cliche2019 cognitohazard doctor-bright glass global-occult-coalition keter media memory-affecting meta narrative neurological scp video visual 
scp-4206,Euclid,site-18,alive animal artifact biological cadaver canine co-authored end-of-death ethics-committee euclid medical neutralized organic scp 
scp-4207,safe,,auditory autonomous cetacean media safe sapient scp sentient 
scp-4208,Safe,,computer humanoid online safe sapient scp 
scp-4209,Safe,,autonomous food safe scp 
scp-421,Euclid,,aquatic autonomous euclid event-featured hive-mind predatory scp sentient wooden 
scp-4210,euclid,,compulsion document euclid memory-affecting mind-affecting scp 
scp-4211,"SCP-4211 is the collective designation for specific diary entries with cognitohazardous properties  these written works contain cognitohazards to prevent reading of the item's true content unless certain conditions are met.1 More specifically, the items encrypt their content via obfuscation, altering the text if the reader does not have access to the cipher key.",,class-of-76 cognitohazard document empathic hallucination interactive memory-affecting mind-affecting safe scp visual 
scp-4212,Euclid,,euclid hostile meta reanimation scp sentient spacetime visual 
scp-4213,Keter,,auditory co-authored cognitohazard humanoid keter observational scp visual 
scp-4214,safe,,art-exchange artistic cognitohazard dado gamers-against-weed media safe scp visual 
scp-4215,euclid,,alive autonomous biological cephalopodic euclid indestructible military sapient scp sentient thermal transfiguration 
scp-4216,Euclid,,animal canine euclid jam-con2019 scp structure wooden 
scp-4217,keter,,animal aquatic biological cephalopodic historical keter military obskura sapient scp self-repairing sentient vehicle 
scp-4218,Euclid,,alexylva anderson co-authored collab-con2019 euclid extradimensional knowledge online scp vincent-anderson 
scp-4219,Thaumiel,site-45,antimemetic auditory cognitohazard memetic olfactory scp thaumiel visual 
scp-422,Safe,,alive animal biological carnivorous reanimation safe scp sentient 
scp-4220,euclid,,4000 abnormalities co-authored euclid extraterrestrial global-occult-coalition gravity gru-division-p historical moon pentagram scp 
scp-4221,euclid,,biological building co-authored euclid extradimensional fungus humanoid scarlet-king scp sentient 
scp-4222,Keter,,animal ethics-committee keter piscine scp 
scp-4223,archon,,archon broken-god cognitohazard food gustatory liquid location scp 
scp-4224,thaumiel,,4000 alive apian doctor-everwood ectoentropic gaseous humanoid liquid neurological sapient scp sentient thaumiel 
scp-4225,safe,site-65,alive animal dr-wondertainment language mister ophidian reptilian safe scp sentient 
scp-4226,Safe Thaumiel,,appliance scp temporal thaumiel 
scp-4227,Keter,,aquatic biological co-authored keter location parasitic portal scp sentient temporal 
scp-4228,Safe,,alive infohazard k-class-scenario keter marshall-carter-and-dark media memetic mind-affecting olfactory scp sensory sleep tactile visual 
scp-4229,Euclid,site-65,indestructible keter memetic portal scp temporal 
scp-423,Safe,,fred mobile narrative safe sapient scp sentient 
scp-4230,Euclid,,cadaver carnivorous euclid liquid predatory scp skeletal transfiguration 
scp-4231,Euclid,,adult building dc-al-fine doctor-clef euclid extradimensional ontokinetic redirect ritual scarlet-king scp sexual 
scp-4232,Euclid,,arthropod artistic euclid knowledge scp 
scp-4233,keter,,alive featured humanoid indestructible keter moon-champion sapient scp uncontained 
scp-4234,euclid,,canine cognitohazard concept euclid intangible jam-con2019 scp sensory 
scp-4235,Safe,site-19,alive entropic marshall-carter-and-dark plant safe scp 
scp-4236,keter,,document entropic extradimensional keter physics reviewers-spotlight scp spacetime 
scp-4237,Euclid,,alive euclid historical humanoid k-class-scenario meteorological sapient scp sentient structure 
scp-4238,Euclid,area-12,euclid fungus neurological parasitic plant scp 
scp-4239,esoteric-class,,bones canine co-authored esoteric-class esther-kogan extradimensional gamers-against-weed global-occult-coalition historical humanoid jockjamsvol6 knowledge mister probability sapient scp sentient temporal uncontained 
scp-424,Safe,,alive metamorphic safe scp swarm 
scp-4240,Safe,,extradimensional game hostile humanoid loop memory-affecting mimetic online reviewers-spotlight ritual safe scp uncontained 
scp-4241,Keter,,insect intangible keter mind-affecting parasitic scp sleep species uncontained 
scp-4242,Thaumiel,,4000 building portal religious ritual scp temporal thaumiel 
scp-4243,Euclid,,autonomous building city euclid mobile scp 
scp-4244,Keter,,compulsion keter musical ontokinetic scp 
scp-4245,Keter,,cognitohazard keter mind-affecting neurological scp visual 
scp-4246,archon,,acoustic aquatic archon cephalopodic city cognitohazard empathic extradimensional hallucination historical hive-mind knowledge light location mind-affecting neurological obskura ontokinetic organic scp sensory sleep structure tactile telekinetic telepathic visual 
scp-4247,Euclid,,antimemetic concept euclid humanoid infohazard narrative scp serpents-hand 
scp-4248,Textual,,building document ectoentropic mind-affecting religious safe scp team-bird 
scp-4249,safe,,alive animal extradimensional furniture marshall-carter-and-dark portal safe scp sentient 
scp-425,Euclid,,appliance cognitohazard electronic euclid map mind-affecting scp transmission visual 
scp-4250,Euclid,,are-we-cool-yet cognitohazard compulsion euclid global-occult-coalition instrument mind-affecting scp visual 
scp-4251,Safe,,gravity location safe scp 
scp-4252,keter,,alive appliance food humanoid keter scp teleportation vehicle 
scp-4253,Safe,,clothing ectoentropic humanoid jewelry metallic safe scp sentient 
scp-4254,Keter,,humanoid intangible keter performance scp sentient 
scp-4255,keter,,alive humanoid k-class-scenario keter paradox sapient scp sentient temporal uncontained 
scp-4256,Thaumiel,,asci chicago-spirit co-authored collab-con2019 ectoentropic factory historical mechanical mind-affecting scp thaumiel tool unusual-incidents-unit 
scp-4257,safe,,dado gustatory medical mobile safe scp transfiguration vehicle 
scp-4258,euclid,,building empathic euclid extradimensional humanoid memory-affecting sapient scp sentient 
scp-4259,Youklid,,antimemetic euclid humanoid infohazard memory-affecting meta ophidian scp 
scp-426,Euclid,,appliance electrical euclid infohazard meta mind-affecting scp 
scp-4260,euclid,,deepwell-catalog entropic euclid humanoid k-class-scenario ontokinetic reanimation scp the-administrator 
scp-4261,Safe,,artifact historical k-class-scenario musical ontokinetic religious safe scarlet-king scp tactical-theology 
scp-4262,Keter,,4000 extraterrestrial game global-occult-coalition historical humanoid k-class-scenario keter planet sapient scp sentient sport telepathic teleportation temporal 
scp-4263,Euclid,site-2498,chaos-insurgency ethics-committee euclid humanoid ontokinetic sapient scp sentient 
scp-4264,safe,,document future global-occult-coalition mathematical observational ontokinetic physics safe scp temporal 
scp-4265,safe,,alive media ophidian recording safe scp sentient 
scp-4266,Keter,,airborne cliche2019 compulsion contagion empathic ethics-committee keter mind-affecting neurological planet scp 
scp-4267,neutralized,,alive humanoid neutralized ontokinetic scp spacetime structure 
scp-4268,Safe,,autonomous canine hostile safe scp statue wooden 
scp-4269,Safe,,adult clothing cognitohazard jam-con2019 mimetic redirect safe scp sensory sexual 
scp-427,Safe* (see containment procedures),,foundation-made jewelry medical safe scp transfiguration 
scp-4270,esoteric-class,area-27,antimemetic biological cadaver esoteric-class historical humanoid infohazard mind-affecting paradox scp ursine 
scp-4271,Keter,,alive asci crystalline geological historical humanoid immobile indestructible insect keter scp stone 
scp-4272,Keter,,alive humanoid keter sapient scp sentient telekinetic telepathic teleportation 
scp-4273,apollyon,,apollyon broken-god cadaver chaos-insurgency global-occult-coalition grand-karcist-ion marshall-carter-and-dark memoria-adytum robert-bumaro sarkic scp the-administrator uncontained 
